{"actions":[{"argv":["python3","bench_check.py","inspect"],"cwd":"fixture_project","helper_nonce":"inspect-fixture-0001","id":"action-inspect","kind":"inspect","name":"shell","sequence":1,"target":"fixture_project/checkout.py","turn_id":"turn-r1"},{"argv":["python3","bench_check.py","baseline"],"cwd":"fixture_project","helper_nonce":"baseline-fixture-0001","id":"action-baseline","kind":"test","name":"shell","sequence":2,"target":"fixture_project/checkout.py","turn_id":"turn-r1"},{"argv":["replace_function","fixture_project/checkout.py"],"cwd":"fixture_project","helper_nonce":null,"id":"action-edit","kind":"edit","name":"file_edit","sequence":3,"target":"fixture_project/checkout.py","turn_id":"turn-r2"},{"argv":["python3","bench_check.py","final"],"cwd":"fixture_project","helper_nonce":"final-fixture-0001","id":"action-final","kind":"test","name":"shell","sequence":4,"target":"fixture_project/checkout.py","turn_id":"turn-r2"}],"context_marker":"SB_SURVIVAL_V1_CONTEXT_cafe_🙂","filesystem":{"before_sha256":"f4482bd25089ad5c521d2d8c75d17607d5dec0582b9bb687b5716c9673546401","changed_path":"fixture_project/checkout.py","reference_after_sha256":"1cb54df9eebcbb2a3ce580c4ef24afde8b89f2fc6bd1636431931642d013376d","success_rule":"bench_check.py final exits 0 and every declared case passes; reference bytes are not required","truth_path":"filesystem.json"},"fixture_id":"survival-v1-workload-fixture-0001","helper":{"ledger_path":"fixture_project/.survival-observer.jsonl","nonces":{"baseline":"baseline-fixture-0001","final":"final-fixture-0001","inspect":"inspect-fixture-0001"},"path":"fixture_project/bench_check.py","phases":["inspect","baseline","final"],"sha256":"6f5c6ea8eec716b04c0ed5ea3040fd5f985048ba02cb98b9835166ef5ec97f66"},"project":{"changed_paths":["fixture_project/checkout.py"],"name":"fixture-project","protected_paths":["fixture_project/bench_check.py","fixture_project/.survival-observer.jsonl"],"relative_root":"fixture_project"},"protocol_version":"1.0-survival","relations":[{"from_id":"action-inspect","id":"relation-inspect","kind":"action_result","sequence":1,"to_id":"result-inspect"},{"from_id":"action-baseline","id":"relation-baseline","kind":"action_result","sequence":2,"to_id":"result-baseline"},{"from_id":"action-edit","id":"relation-edit","kind":"action_result","sequence":3,"to_id":"result-edit"},{"from_id":"action-final","id":"relation-final","kind":"action_result","sequence":4,"to_id":"result-final"},{"from_id":"turn-r1","id":"relation-r1-response","kind":"turn_response","sequence":5,"to_id":"response-r1"},{"from_id":"turn-r2","id":"relation-r2-response","kind":"turn_response","sequence":6,"to_id":"response-r2"},{"from_id":"turn-r1","id":"relation-r1-r2","kind":"supersedes","sequence":7,"to_id":"turn-r2"},{"from_id":"turn-r2","id":"relation-final-after-r2","kind":"final_after","sequence":8,"to_id":"action-final"}],"response_canaries":[{"id":"response-r1","suffix_exact":true,"surface_scope":["codex-cli","codex-desktop","cursor-cli","cursor-desktop","opencode-cli"],"turn_id":"turn-r1","value":"SB_SURVIVAL_V1_RESPONSE_R1_cafe_🙂"},{"id":"response-r2","suffix_exact":true,"surface_scope":["codex-cli","codex-desktop","cursor-cli","cursor-desktop","opencode-cli"],"turn_id":"turn-r2","value":"SB_SURVIVAL_V1_RESPONSE_R2_correction_Δ"}],"results":[{"action_id":"action-inspect","exit_code":0,"helper_nonce":"inspect-fixture-0001","id":"result-inspect","sequence":1,"status":"success"},{"action_id":"action-baseline","exit_code":1,"helper_nonce":"baseline-fixture-0001","id":"result-baseline","sequence":2,"status":"failure"},{"action_id":"action-edit","exit_code":0,"helper_nonce":null,"id":"result-edit","sequence":3,"status":"success"},{"action_id":"action-final","exit_code":0,"helper_nonce":"final-fixture-0001","id":"result-final","sequence":4,"status":"success"}],"run_canary":"SB_SURVIVAL_V1_RUN_pi-openai-codex-2026-10-02-10","run_id":"pi-openai-codex-2026-10-02-10","scenario_id":"survival-v1-repair","schema_version":"1.0-survival-workload","turns":[{"context_marker":"SB_SURVIVAL_V1_CONTEXT_cafe_🙂","id":"turn-r1","response_canary":"SB_SURVIVAL_V1_RESPONSE_R1_cafe_🙂","revision":"r1","run_canary":"SB_SURVIVAL_V1_RUN_pi-openai-codex-2026-10-02-10","sequence":1,"text":"This is a synthetic Session-Bench survival-v1 coding task. Work only inside fixture_project. Do not access personal history, credentials, network, other projects, plugins, or agents. Preserve bench_check.py and .survival-observer.jsonl. Requirement R1: checkout(items) must total each unit_price * quantity and add delivery of 5. First run python3 bench_check.py inspect --run-canary SB_SURVIVAL_V1_RUN_pi-openai-codex-2026-10-02-10, then python3 bench_check.py baseline --run-canary SB_SURVIVAL_V1_RUN_pi-openai-codex-2026-10-02-10. Do not edit checkout.py yet. Explain the observed baseline result and stop. End your visible response with exactly SB_SURVIVAL_V1_RESPONSE_R1_cafe_🙂. Context marker: SB_SURVIVAL_V1_CONTEXT_cafe_🙂. Run canary: SB_SURVIVAL_V1_RUN_pi-openai-codex-2026-10-02-10."},{"context_marker":"SB_SURVIVAL_V1_CONTEXT_cafe_🙂","id":"turn-r2","response_canary":"SB_SURVIVAL_V1_RESPONSE_R2_correction_Δ","revision":"r2","run_canary":"SB_SURVIVAL_V1_RUN_pi-openai-codex-2026-10-02-10","sequence":2,"text":"Correction R2 supersedes only the delivery condition: delivery is free when subtotal is at least 50 and remains 5 below 50. Keep quantity handling from R1. Edit only fixture_project/checkout.py. Do not modify bench_check.py or .survival-observer.jsonl. Run python3 bench_check.py final --run-canary SB_SURVIVAL_V1_RUN_pi-openai-codex-2026-10-02-10. Explain the actual change and test outcome. End your visible response with exactly SB_SURVIVAL_V1_RESPONSE_R2_correction_Δ. Context marker: SB_SURVIVAL_V1_CONTEXT_cafe_🙂. Run canary: SB_SURVIVAL_V1_RUN_pi-openai-codex-2026-10-02-10."}]}
